{
  "id": "note_sample1jn1",
  "scope": {
    "kind": "chapter",
    "osis": "1JN.1",
    "slug": "1jn.1"
  },
  "body": "# 1 John 1 — walking in the light\n\nv1 — \"That which was from the beginning\" echoes Gen 1:1 and Jn 1:1. Eyewitness chain: heard, seen, looked upon, touched.\n\nv3 — fellowship (koinonia) is the stated purpose of proclamation, not just information transfer.\n\nv5 — God is light; no darkness *at all*. The absolute framing sets up the impossibility of v6.\n\nv7 — walking in the light does not mean sinlessness (v8 immediately denies that) — it means living exposed, not hidden.\n\nv9 — confession is agreement with the light, and the promise is double: forgive AND cleanse.\n\nQ: how does v9's conditionality relate to the finished cleansing in v7?\n",
  "created_at": "2026-07-31T09:00:00.000Z",
  "updated_at": "2026-07-31T09:00:00.000Z"
}
