{
  "id": "note_demo1",
  "scope": { "kind": "verse", "osis": "JHN.3.16", "slug": "jhn.3.16" },
  "blocks": [
    { "id": "b1", "indent": 0, "text": "God so loved" },
    { "id": "b2", "indent": 1, "text": "the world" }
  ],
  "attachments": [],
  "created_at": "2026-01-01T00:00:00Z",
  "updated_at": "2026-01-01T00:00:00Z"
}
