{
  "id": "note_samplejhn316",
  "scope": {
    "kind": "verse",
    "osis": "JHN.3.16",
    "slug": "jhn.3.16"
  },
  "blocks": [
    { "id": "b_316a", "indent": 0, "text": "\"God so loved\" — houtos is manner, not degree: *this is how* God loved." },
    { "id": "b_316b", "indent": 1, "text": "cf. 1 Jn 4:9, nearly the same sentence." },
    { "id": "b_316c", "indent": 0, "text": "\"gave his only Son\" echoes Gen 22 — Abraham and Isaac." },
    { "id": "b_316d", "indent": 0, "text": "perish/eternal life is the verse's real contrast, not love/wrath." }
  ],
  "created_at": "2026-07-31T09:05:00.000Z",
  "updated_at": "2026-07-31T09:05:00.000Z"
}
